0,TASK,Сходить в магазин,NEW,купить много продуктов,0,1900-01-01T00:00
1,TASK,Помыть кота,NEW,приготовить набор первой помощи,0,1900-01-01T00:00
5,TASK,Доделать ТЗ,NEW,Сдать ТЗ на проверку,0,1900-01-01T00:00
6,TASK,Посмотреть фильм,NEW,RIDDIK,0,1900-01-01T00:00
2,EPIC,Погрузиться в Звездные войны,NEW,Посмотреть фильмы и  сериалы Звездных войн,0,1900-01-01T00:00,1900-01-01T00:00
3,SUBTASK,Посмотреть Звездные войны Изгой,NEW,Приготовить закуску, напитки, посмотреть Звездные войны Изгой,2,0,1900-01-01T00:00
4,SUBTASK,Начать смотреть сериал Андор,NEW,Приготовить закуску, кофе, выключить телефон, нечать смотреть,2,0,1900-01-01T00:00
